sessao_tecnica	cadeira	artigo	autores
ST1 – USER EXPERIENCE 09:00	Carlos Ferraz (UFPE)	A Generative Software Development approach for mulsemedia application domain	Marcelo F. de Sousa, (IESP), Raoni Kulesza (UFPB), Carlos André G. Ferraz (UFPE),Matheus Lima (UFPB)
ST1 – USER EXPERIENCE 09:00	Carlos Ferraz (UFPE)	Synthesizing guidelines for facilitating elderly-smartphone interaction	Bruna C.R. Cunha (USP/IFSP), Kamila R.H. Rodrigues (USP), Maria da Graça C.Pimentel (USP)
ST1 – USER EXPERIENCE 09:00	Carlos Ferraz (UFPE)	A data exploratory methodology to understand the users’ interactions in nonlinear Web multimedia services	Diego Carvalho (UFSJ), Nícollas Silva (UFMG), Alan Cardoso (UFSJ), Elverton Fazzion(UFSJ), Adriano C.M. Pereira (UFMG), Leonardo Rocha (UFSJ)
ST1 – USER EXPERIENCE 09:00	Carlos Ferraz (UFPE)	Comparative Study of User Experience Evaluation Techniques Based on Mouse and Gaze Tracking	Igor Leonardo Aviz (UFPA), Kennedy Edson Souza (UFPA), Elison H.B. Ribeiro (UFPA),Harold de Mello Junior (UERJ), Marcos César da R. Seruffo (UFPA)
ST1 – USER EXPERIENCE 09:00	Carlos Ferraz (UFPE)	A Model-Based Approach to Generate Reactive and Customizable User Interfaces for the Web Of Things	Jagni D.H. Bezerra (IFCE), Cidcley T. de Souza (IFCE)
ST1 – USER EXPERIENCE 09:00	Carlos Ferraz (UFPE)	User Interface Prototype Generation from Agile Requirements Specifications written in Concordia	Thiago D. Pinto (CEFET/RJ), Willian I. Gonçalves (CEFET/RJ), Pablo V. Costa (CEFET/RJ)
ST2 – INTERNET OF THINGS 09:00	Diego Brandão (CEFET/RJ)	Cluster-Head Switching Algorithm Based on Node Temperature in Wireless Body Sensors Networks	Creyton B. de M. Ferreira (CEFET/RJ), Raphael M. Guedes (UFRJ), Felipe da R.Henriques (CEFET/RJ)
ST2 – INTERNET OF THINGS 09:00	Diego Brandão (CEFET/RJ)	Pragmatic Interoperability in IoT: A Systematic Mapping Study	Matheus H.S. Muniz (UFJF), José Maria N. David (UFJF), Regina Braga (UFJF),Fernanda Campos (UFJF), Victor Strölle (UFJF)
ST2 – INTERNET OF THINGS 09:00	Diego Brandão (CEFET/RJ)	An IoT Multi-Protocol Strategy for the Interoperability of Distinct Communication Protocols applied to Web of Things	Vinícius A. Barros (USP), Sérgio A.B. Junior (USP), Sarita M. Bruschi (USP), Francisco J.Monaco (USP), Júlio C. Estrella (USP)
ST2 – INTERNET OF THINGS 09:00	Diego Brandão (CEFET/RJ)	Smart “Health of Things”: a Model Based in Data Mining for an IoT Health System Used in Hospital and Home Urgencies	Oton C. Braga (UFERSA/UERN), Francisco M. Mendes Neto (UFERSA), Antônio M.B.de Oliveira (IFCE), Raimundo Valter Costa Filho (IFCE)
ST2 – INTERNET OF THINGS 09:00	Diego Brandão (CEFET/RJ)	Performance Evaluation and Comparison of Default and Small Private Key Rainbow Digital Signature Scheme for IoT Devices	Matheus da F. Dornelles (CEFET/RJ), Pedro Carlos da S. Lara (CEFET/RJ), Felipe da R.Henriques (CEFET/RJ)
ST2 – INTERNET OF THINGS 09:00	Diego Brandão (CEFET/RJ)	Towards a model to optimized collect of vital signs through adaptive strategies	Jorge Arthur S. Aranda (Unisinos), Lucas P.S. Dias (Unisinos), Alexandre S. Wolf(Unisinos), Juliano V. de Carvalho (Univ. Feevale), Maurício C. Tavares (Contronic),Adenauer C. Yamin (UCPEL), Jorge L.V. Barbosa (Unisinos)
ST3 – E-HEALTH AND ACCESSIBILITY 14:00	Eduardo Bezerra (CEFET/RJ)	A Study on the Use of Sequence-to-Sequence Neural Networks for Automatic Translation of Brazilian Portuguese to LIBRAS	Vinícius Veríssimo (UFPB), Cecília Silva (UFPB), Vitor Hanael (UFPB), Caio Moraes(UFPB), Rostand Costa (UFPB), Tiago Maritan U. Araújo (UFPB), Manuella A.C.B. Lima(UFPB), Thaís G. do Rêgo (UFPB)
ST3 – E-HEALTH AND ACCESSIBILITY 14:00	Eduardo Bezerra (CEFET/RJ)	Using Convolutional Neural Networks for Fingerspelling Sign Recognition in Brazilian Sign Language	Douglas F.L. Lima (UFPB), Armando S. Salvador Neto (UFPB), Ewerton N. Santos(UFPB), Tiago Maritan U. Araújo (UFPB), Thaís G. do Rêgo (UFPB)
ST3 – E-HEALTH AND ACCESSIBILITY 14:00	Eduardo Bezerra (CEFET/RJ)	Analysis of Rule-Based Machine Translation and Neural Machine Translation Approaches for Translating Portuguese to LIBRAS	Caio César M. de Oliveira (UFPB), Thaís G. do Rêgo (UFPB), Manuella A.C.B. Lima(UFPB), Tiago Maritan U. Araújo (UFPB)
ST3 – E-HEALTH AND ACCESSIBILITY 14:00	Eduardo Bezerra (CEFET/RJ)	Mobile Applications in the Care of Children and Teenagers in Oncological Treatment	Paula A. Knob (Unisinos), Andrêsa V. Larentis (Unisinos), Débora N.F. Barbosa (Univ.Feevale), Carla R. da Silva (AMO Criança), Jorge L.V. Barbosa (Unisinos)
ST3 – E-HEALTH AND ACCESSIBILITY 14:00	Eduardo Bezerra (CEFET/RJ)	A Blockchain-Based Approach for Privacy Control of Patient’s Medical Records in the Fog Layer	Cícero A. Silva (UFRN), Gibeon S. de Aquino Júnior (UFRN), Sávio R.M. Melo (UFRN)
ST3 – E-HEALTH AND ACCESSIBILITY 14:00	Eduardo Bezerra (CEFET/RJ)	Using Chatbots to Compare Drug Prices Extracted in Real-Time from the WEB	Caio Viktor S. Avila (UFC), Vania P. Vidal (UFC), Asley Caldas (UFC), Tulio V. Rolim (UFC),Thays Lavor (UFC)
ST3 – E-HEALTH AND ACCESSIBILITY 14:00	Eduardo Bezerra (CEFET/RJ)	Towards a Ubiquitous Care Model for Patients with Anxiety Disorders	Lucas P.S. Dias (Unisinos), Jorge L.V. Barbosa (Unisinos)
ST4 – MEDIA CODING AND TRANSMISSION 14:00	Valter Roesler (UFRGS)	Aequilibrium – MPEG-DASH Video Servers Load Balancing Approaches with Software-Defined Networking	Edenilson Jônatas dos Passos (UDESC), Adriano Fiorese (UDESC)
ST4 – MEDIA CODING AND TRANSMISSION 14:00	Valter Roesler (UFRGS)	Identification of Speechless Intervals in Audio Tracks using Convolutional Neural Networks	Vinícius Wanderley (UFPB), Leonardo Villeth (UFPB), Virgínia P. Campos (UFRN), TiagoMaritan U. Araújo (UFPB), Thaís G. do Rêgo (UFPB)
ST4 – MEDIA CODING AND TRANSMISSION 14:00	Valter Roesler (UFRGS)	Fast Partitioning Decision Making for Prediction Units on H.264-to-HEVC Transcoding Using Machine Learning	Yan Soares (UFPel), Guilherme Corrêa (UFPel), Luciano Agostini (UFPel)
ST4 – MEDIA CODING AND TRANSMISSION 14:00	Valter Roesler (UFRGS)	An Evolutionary Approach for Video Application Energy Consumption Estimation in Mobile Devices	Irandir O. de Amorim (UPE), Jose F.V. de Melo (UPE), Andson M. Balieiro (UFRPE),Bruno B. dos Santos (UPE)
ST4 – MEDIA CODING AND TRANSMISSION 14:00	Valter Roesler (UFRGS)	Development of a Naive Bayes classifier for image quality assessment in biometric face images	Armando M. Gutiérrez (USP), Patricia A. Pacheco (USP), José C. Gutiérrez (USP), GraçaBressan (USP)
ST4 – MEDIA CODING AND TRANSMISSION 14:00	Valter Roesler (UFRGS)	Evaluation of Machine Learning Algorithms for Fast Video Transcoding in Streaming Services	Thiago Bubolz (UFPel), Bruno Zatt (UFPel), Mateus Grellert (UCPel), Guilherme Corrêa(UFPel)
ST5 – AUTHORING 09:00	Manoel Neto (IFBA)	Elderly Vloggers: Authoring and Sharing Stories with Mobile Media and DTV Using the the GhostWriter Service	Caio C. Viel (Sidia), Kamila R.H. Rodrigues (USP), Bruna C.R. Cunha (IFSP), Maria daGraça C. Pimentel (USP)
ST5 – AUTHORING 09:00	Manoel Neto (IFBA)	Increasing reuse in learning objects authoring: a case study with the Cacuriá tool	Thacyla de S. Lima (UFMA), Roberto Gerson de A. Azevedo (UPFL, Switzerland), Carlosde S. Soares Neto (UFMA)
ST5 – AUTHORING 09:00	Manoel Neto (IFBA)	Toward Understanding the Quality of Subtitle Synchronization to Improve the Viewer Experience	Jessica O. Brito (UFES), Celso A.S. Santos (UFES), Rodrigo L. Guimarães (UFES),Thiago Felipe C. Borges (UFES)
ST5 – AUTHORING 09:00	Manoel Neto (IFBA)	An Optimization Model for Temporal Video Lecture Segmentation using Word2vec and Acoustic Features	Eduardo R. Soares (UFJF), Eduardo Barrére (UFJF)
ST5 – AUTHORING 09:00	Manoel Neto (IFBA)	Adding Temporal Semantic to Textual Media Objects with Eye Tracking Technology	Ellen P. Silva (CEFET/RJ), Glauco F. Amorim (CEFET/RJ), Joel A.F. dos Santos (CEFET/RJ)
ST6 – SOCIAL NETWORKS I 09:00	Raoni Kulesza (UFPB)	Parrot Talk: Retweeting Among Twitter Users During the 2018 Brazilian Presidential Election	Jordan K. Kobellarz (UTFPR), Alexandre R. Graeml (UTFPR), Michelle Reddy (StanfordUniv., USA), Thiago H. Silva (UTFPR)
ST6 – SOCIAL NETWORKS I 09:00	Raoni Kulesza (UFPB)	Characterization of the Discrepancies between Scores and Texts of Movie Reviews	Karen S. Martins (UFMG), Pedro O.S. Vaz de Melo (UFMG)
ST6 – SOCIAL NETWORKS I 09:00	Raoni Kulesza (UFPB)	The Times They Are A-Changin’ (or not): song lyrics analysis over the years	Carolina C. Vieira (UFMG), Túlio C. Loures (UFMG), Pedro O.S. Vaz de Melo (UFMG),Renato M. Assunção (UFMG)
ST6 – SOCIAL NETWORKS I 09:00	Raoni Kulesza (UFPB)	Using topic modeling to find main discussion topics in Brazilian political websites	Vithor G. Bertalan (USP), Evandro Eduardo S. Ruiz (USP)
ST6 – SOCIAL NETWORKS I 09:00	Raoni Kulesza (UFPB)	Quality Assessment of Wikipedia Content Using Topic Models	Lauro C.J. Santos (CEFET-MG), Taís Christofani (CEFET-MG), Ismael S. Silva (CEFETMG), Daniel H. Dalip (CEFET-MG)
ST6 – SOCIAL NETWORKS I 09:00	Raoni Kulesza (UFPB)	Automatic identification of Irony: a Case Study on Twitter	Yulli D.T. Alves (CEFET-MG), Ana Luiza Sanches (CEFET-MG), Daniel H. Dalip (CEFETMG), Ismael S. Silva (CEFET-MG)
ST7 – SYSTEMS AND MIDDLEWARE 14:00	Celso Saibel (UFES)	NuGingaJS: a Full Portable ITU-T H.761 Ginga Middleware for DTV and IPTV	Rodrigo Braga (SIDIA), Volnei Klehm (SIDIA), Lauro Gama (SIDIA), Michael Mello (SIDIA),Taynara Paiva (SIDIA), Dina Nogueira (SIDIA), Ruddá Beltrão (SIDIA), Addison Lima(SIDIA), Leonardo Santana (SIDIA), Lois Nascimento (SIDIA), Chak Lee (SIDIA), FelipeTravassos (SIDIA)
ST7 – SYSTEMS AND MIDDLEWARE 14:00	Celso Saibel (UFES)	Middleware architecture towards higher-level descriptions of (genuine) Internet-of-Things applications	Thomás M.B. Reis (UFJF), Marcelo F. Moreno (UFJF)
ST7 – SYSTEMS AND MIDDLEWARE 14:00	Celso Saibel (UFES)	A Proposal for Supporting Sensory Effect Rendering in Ginga-NCL	Renato O. Rodrigues (CEFET/RJ), Marina I.P. Josué (UFF), Raphael S. Abreu (UFF),Glauco F. Amorim (CEFET/RJ), Débora C. Muchaluat-Saade (UFF), Joel A.F. dos Santos(CEFET/RJ)
ST7 – SYSTEMS AND MIDDLEWARE 14:00	Celso Saibel (UFES)	Apollo APA: Towards a Model to Care of People with Hearing Impairment in Smart Environments	João E. da R. Tavares (Unisinos), Tefferson D. da R. Guterres (Unisinos), Jorge L.V.Barbosa (Unisinos)
ST7 – SYSTEMS AND MIDDLEWARE 14:00	Celso Saibel (UFES)	Automatic Preparation of Media Objects in Multimedia Applications	Marina Ivanov (UFF), Marcelo F. Moreno (UFJF), Débora C. Muchaluat-Saade (UFF)
ST8 – SOCIAL NETWORKS II 14:00	Thiago H Silva (UTFPR)	Link Prediction in Social Networks: Combining Topological and Contextual Data in a Community Detection Based Method	Camila M. de Moraes (IME), Eduardo Bezerra (CEFET/RJ), Ronaldo R. Goldschmidt(IME)
ST8 – SOCIAL NETWORKS II 14:00	Thiago H Silva (UTFPR)	Leveraging the Facebook Ads Platform for Election Polling	Filipe N. Ribeiro (UFOP/UFMG), Daniel Kansaon (UFMG), Fabrício Benevenuto (UFMG)
ST8 – SOCIAL NETWORKS II 14:00	Thiago H Silva (UTFPR)	Cross-Cultural Study of Tourists Mobility Using Social Media	David A.M. Veiga (UTFPR), Gabriel B. Frizzo (UTFPR), Thiago H. Silva (UTFPR)
ST8 – SOCIAL NETWORKS II 14:00	Thiago H Silva (UTFPR)	Measurement of Mobilization Capacity via Actions Sequence Learning within Institutional Facebook Fan Pages	Kaique Matheus R. Cunha (IFG), Alan K. Gomes (IFG)
ST8 – SOCIAL NETWORKS II 14:00	Thiago H Silva (UTFPR)	Data mining applied in fake news classification through textual patterns	Marcos Paulo Moraes (UFRJ), Jonice Oliveira (UFRJ), Anderson C. Charles (UFRJ)
ST8 – SOCIAL NETWORKS II 14:00	Thiago H Silva (UTFPR)	Hate Speech Detection Using Brazilian Imageboards	Gabriel Nascimento (CEFET/RJ), Flavio Carvalho (CEFET/RJ), Alexandre M. da Cunha(CEFET/RJ-UFF), Carlos Roberto Viana (CEFET/RJ), Gustavo P. Guedes (CEFET/RJ)
ST8 – SOCIAL NETWORKS II 14:00	Thiago H Silva (UTFPR)	Discovering Patterns in Sentimental Analysis	Flavio Carvalho (CEFET/RJ), Leonardo P. dos Santos (CEFET/RJ), Heraldo Borges(CEFET/RJ), Eduardo Ogasawara (CEFET/RJ), Gustavo P. Guedes (CEFET/RJ)
ST9 – RECOMMENDER SYSTEMS 09:00	Roberto Willrich (UFSC)	A Characterization Methodology for Candidates and Recruiters Interaction in Online Recruitment Services	Alan Cardoso (UFSJ), Fernando Mourão (Seek AI Labs), Leonardo Rocha (UFSJ)
ST9 – RECOMMENDER SYSTEMS 09:00	Roberto Willrich (UFSC)	Exploiting the User Activity-Level to Improve the Models’ Accuracy in Point-Of-Interest Recommender Systems	Luiz Chaves (UFSJ), Nícollas Silva (UFMG), Rodrigo Carvalho (UFSJ), Adriano C.M.Pereira (UFMG), Leonardo Rocha (UFSJ)
ST9 – RECOMMENDER SYSTEMS 09:00	Roberto Willrich (UFSC)	Geographic-categorical diversification in POI recommendations	Rodrigo Carvalho (UFSJ), Nícollas Silva (UFMG), Luiz Chaves (UFSJ), Adriano C.M.Pereira (UFMG), Leonardo Rocha (UFSJ)
ST9 – RECOMMENDER SYSTEMS 09:00	Roberto Willrich (UFSC)	From Pizza to Curry: Preferences for Recipes Around the World	Juliana Viscenheski (UTFPR), Artur Ziviani (LNCC), Thiago H. Silva (UTFPR)
ST9 – RECOMMENDER SYSTEMS 09:00	Roberto Willrich (UFSC)	Smartalloc: A model based on Machine Learning for human resource allocation in projects	Eduardo J. Kieling (Unisinos), Felipe C. Rodrigues (Unisinos), Alexsandro Filippetto(Unisinos), Jorge L.V. Barbosa (Unisinos)
ST10 – SOCIAL NETWORKS III 09:00	Adriano Pereira (UFMG)	Causality Analysis Between Collaboration Profiles and Musical Success	Mariana O. Silva (UFMG), Mirella M. Moro (UFMG)
ST10 – SOCIAL NETWORKS III 09:00	Adriano Pereira (UFMG)	Analyzing the Acceptance of the 2018 Brazilian Presidential Election’ Main Candidates Based on YouTube Comments	Cristian A. Silva (UFV), Daniel M. Barbosa (UFV)
ST10 – SOCIAL NETWORKS III 09:00	Adriano Pereira (UFMG)	The Influence of Tweets and News on the Brazilian Stock Market Through Sentiment Analysis	Arthur E. de O. Carosia (IFSP, Unicamp), Guilherme P. Coelho (Unicamp), Ana E.A. daSilva (Unicamp)
ST10 – SOCIAL NETWORKS III 09:00	Adriano Pereira (UFMG)	Data Science in Financial Markets: Characterization and Analysis of StockTwits	Rodrigo S. Ferreira (CEFET-MG), Adriano C.M. Pereira (UFMG), Ozório J.S. Camargos(CEFET-MG), Michele A. Brandão (IFMG)
ST10 – SOCIAL NETWORKS III 09:00	Adriano Pereira (UFMG)	A framework for the analysis of information propagation in social networks combining complex networks and text mining techniques	Carlos Magno G. Barbosa (UFSJ), Lucas Gabriel da S. Felix (UFMG), Carolina R. Xavier(UFSJ), Vinícius da F. Vieira (UFSJ)
ST11 – LINKED DATA, METADATA AND ONTOLOGIES 09:00	Alessandra Alaniz (USP-RP)	A personalized clustering-based approach using open linked data for search space reduction in recommender systems	Arthur F. da Costa (ELDORADO, USP), Rafael M. D’Addio (USP), Eduardo P. Fressato(USP), Marcelo G. Manzato (USP)
ST11 – LINKED DATA, METADATA AND ONTOLOGIES 09:00	Alessandra Alaniz (USP-RP)	Semantic Enrichment and Exploration of Open Dataset Tags	Bruno P.C. de Castro (UFRJ), Henrique F. Rodrigues (UFRJ), Giseli R. Lopes (UFRJ),Maria Luiza M. Campos (UFRJ)
ST11 – LINKED DATA, METADATA AND ONTOLOGIES 09:00	Alessandra Alaniz (USP-RP)	An Item-Item Similarity Approach based on Linked Open Data Semantic Relationship	Ítalo M. Pereira (IFMG), Anderson A. Ferreira (UFOP)
ST11 – LINKED DATA, METADATA AND ONTOLOGIES 09:00	Alessandra Alaniz (USP-RP)	LODGVis – An Interactive Visualization for Linked Open Data Navigation	Danilo B. Coimbra (UFBA), José O.M. Negrão (UFBA), Frederico A. Durão (UFBA)
ST11 – LINKED DATA, METADATA AND ONTOLOGIES 09:00	Alessandra Alaniz (USP-RP)	A crowdsourcing web system for curating empirical knowledge in Linked Open Data	Marcela M.M. Yagui (UFRJ), Adriana S. Vivacqua (UFRJ)
ST12 – SMART CITIES & IOT 14:00	Eduardo Ogasawara (CEFET/RJ)	An Ergonomic Evaluation Method Using a Mobile Depth Sensor and Pose Estimation	Pedro V.A. de Freitas (PUC-Rio), Paulo Renato C. Mendes (UFMA), Antonio José G.Busson (PUC-Rio), Álan L.V. Guedes (PUC-Rio), Giovanni Lucca F. da Silva (UFMA),Anselmo C. de Paiva (UFMA), Sérgio Colcher (PUC-Rio)
ST12 – SMART CITIES & IOT 14:00	Eduardo Ogasawara (CEFET/RJ)	A Ranking Method for Location-based Categorical Data in Smart Cities	Alice A.F. Menezes (UFAM), Carlos M.S. Figueiredo (UEA)
ST12 – SMART CITIES & IOT 14:00	Eduardo Ogasawara (CEFET/RJ)	A Location-based Architecture for Video Stream Selection in the Context of IoMT	Diogo de C. Perdomo (UFF), José Viterbo (UFF), Débora C. Muchaluat-Saade (UFF)
ST12 – SMART CITIES & IOT 14:00	Eduardo Ogasawara (CEFET/RJ)	Towards Adapting BitTorrent for Interactive On-Demand Multimedia Streaming over MANETs	Carlo K. da S. Rodrigues (UFABC), Vladimir E.M. Rocha (UFABC)
ST12 – SMART CITIES & IOT 14:00	Eduardo Ogasawara (CEFET/RJ)	Collaborative Information System to Find Efficient Routes Using Public Transport	Diego H.B. Zanchett (CEFET/RJ), Jurair R. de P. Junior (CEFET/RJ), Andre F. Monteiro(CEFET/RJ), Diego B. Haddad (CEFET-RJ), Laura S. de Assis (CEFET/RJ)
ST12 – SMART CITIES & IOT 14:00	Eduardo Ogasawara (CEFET/RJ)	Topology Control Optimization of Wireless Sensor Networks for IoT Applications	Jorge A.G. de Brito (CEFET/RJ), Jurair R. de P. Junior (CEFET/RJ), Felipe da R.Henriques (CEFET/RJ), Laura S. de Assis (CEFET/RJ)
ST13 – INTELLIGENT SERVICES AND APPLICATIONS 14:00	Glauco Amorim (CEFET/RJ)	REALM: An Altmetrics-based Web System to Map Science Impacts on Society. A Case Study on Chikungunya Research	Luís Fernando M.P. Maia (UFRJ), Marcia Lenzi (Fiocruz), Jonice Oliveira (UFRJ)
ST13 – INTELLIGENT SERVICES AND APPLICATIONS 14:00	Glauco Amorim (CEFET/RJ)	A Model for Productivity and Soil Fertility Prediction oriented to Ubiquitous Agriculture	Gilson A. Helfer (Unisinos), Jorge L.V. Barbosa (Unisinos), Adilson Ben da Costa(UNISC), Bruno G. Martini (Unisinos), Ronaldo dos Santos (UNISC)
ST13 – INTELLIGENT SERVICES AND APPLICATIONS 14:00	Glauco Amorim (CEFET/RJ)	SemanticSefaz: An ontology-based semantic portal for the government spending	Tulio V. Rolim (UFC), Vania P. Vidal (UFC), Caio Viktor S. Avila (UFC), Matheus M.L. daCruz (UFC), Matheus G.P. Barrio (UFC), Daniel Queiroz (UFC)
ST13 – INTELLIGENT SERVICES AND APPLICATIONS 14:00	Glauco Amorim (CEFET/RJ)	A Computational Model for Ubiquitous Intelligent Services in Indoor Agriculture	Bruno G. Martini (Unisinos), Gilson A. Helfer (Unisinos), Jorge L.V. Barbosa (Unisinos),Marcio R. da Silva (Unisinos), Rodrigo M. Figueiredo (Unisinos), Regina C.E. Modolo(Unisinos), Adenauer C. Yamin (UCPEL)
ST13 – INTELLIGENT SERVICES AND APPLICATIONS 14:00	Glauco Amorim (CEFET/RJ)	LARIISA: an Intelligent Platform to Help Decision Makers in the Brazilian Health Public System	Luiz Odorico M. Andrade (Fiocruz), Raimundo Valter (IFCE), Ronaldo Ramos (IFCE),Vania Vidal (UFC), Daniel Andrade (AVICENA), Mauro Oliveira (IFCE)
ST14 – MEDIA CONTENT ANALYSIS 14:00	Alan Guedes (PUC-Rio)	Popularity-based Top-k Spatial-keyword Preference Query	Cláudio Moisés V. de Andrade (UEFS), João B. Rocha-Junior (UEFS)
ST14 – MEDIA CONTENT ANALYSIS 14:00	Alan Guedes (PUC-Rio)	Semi-automatic Synchronization of Sensory Effects in Mulsemedia Authoring Tools	Raphael S. Abreu (UFF), Douglas Mattos (UFF), Joel A.F. dos Santos (CEFET/RJ),Débora C. Muchaluat-Saade (UFF)
ST14 – MEDIA CONTENT ANALYSIS 14:00	Alan Guedes (PUC-Rio)	Fake News Detection on Social Media via Implicit Crowd Signals	Paulo Márcio S. Freire (IME), Ronaldo R. Goldschmidt (IME)
ST14 – MEDIA CONTENT ANALYSIS 14:00	Alan Guedes (PUC-Rio)	FACTCK.BR: A new Dataset to Study Fake News	João Moreno (USP), Graça Bressan (USP)
ST14 – MEDIA CONTENT ANALYSIS 14:00	Alan Guedes (PUC-Rio)	A Baseline for NSFW Video Detection in E-Learning Environments	Pedro V.A. de Freitas (PUC-Rio), Gabriel N.P. dos Santos (PUC-Rio), Antonio J.G.Busson (PUC-Rio), Álan L.V. Guedes (PUC-Rio), Sérgio Colcher (PUC-Rio)
ST14 – MEDIA CONTENT ANALYSIS 14:00	Alan Guedes (PUC-Rio)	iAWARE: Um modelo para Cuidado ubíquo de Pacientes com Transtornos de Ansiedade, Depressão e Estresse utilizando Gamificação e Biodata	Lucas Pfeiffer Salomão Dias (Unisinos), Jorge Luis Victória Barbosa (Unisinos)
ST14 – MEDIA CONTENT ANALYSIS 14:00	Alan Guedes (PUC-Rio)	Mais de um sentido: Facilitando a autoria, sincronização e execução de efeitos sensoriais em linguagens multimídia	Raphael Abreu (CEFET/RJ), Eduardo Bezerra (CEFET/RJ), Joel dos Santos (CEFET/RJ)
ST14 – MEDIA CONTENT ANALYSIS 14:00	Alan Guedes (PUC-Rio)	Time Reduction on 3D-HEVC Depth Maps Coding using Static Decision Trees Built Through Data Mining	Mário Saldanha (UFPel), Marcelo Porto (UFPel), César Marcon(PUCRS), LucianoAgostini (UFPel)
ST14 – MEDIA CONTENT ANALYSIS 14:00	Alan Guedes (PUC-Rio)	Um Serviço de Offloading de Dados Contextuais com Suporte à Privacidade	Francisco Gomes (UFC), Lincoln Rocha (UFC), Fernando Trinta (UFC)
ST14 – MEDIA CONTENT ANALYSIS 14:00	Alan Guedes (PUC-Rio)	Extending multimedia languages to support multimodal-multiuser interactions	Álan L.V. Guedes (PUC-Rio), Simone D.J. Barbosa (PUC-Rio)
ST14 – MEDIA CONTENT ANALYSIS 14:00	Alan Guedes (PUC-Rio)	Leiautes Dinâmicos para Documentos Multimídia Baseados em Templates	Glauco Fiorott Amorim (CEFET/RJ), Débora Christina Muchaluat-Saade (UFF)
ST14 – MEDIA CONTENT ANALYSIS 14:00	Alan Guedes (PUC-Rio)	Relevance, Novelty, Diversity and Personalization in Tag Recommendation	Fabiano Muniz Belém (UFMG), Jussara Marques Almeida (UFMG), Marcos AndréGonçalves (UFMG)
ST14 – MEDIA CONTENT ANALYSIS 14:00	Alan Guedes (PUC-Rio)	Tie Strength in Co-authorship Social Networks: Analyses, Metrics and a New Computational Model	Michele A. Brandão (IFMG), Mirella Moro (UFMG)
ST14 – MEDIA CONTENT ANALYSIS 14:00	Alan Guedes (PUC-Rio)	User Preference Dynamics on Evolving Social Networks – Learning, Modeling and Prediction	Fabiola S.F. Pereira (UFU), Gina M.B. Oliveira (UFU), João Gama (Univ. of Porto,Portugal)
ST14 – MEDIA CONTENT ANALYSIS 14:00	Alan Guedes (PUC-Rio)	Evaluating user experience elements on a web system to support physiotherapeutic treatment	Miriéle dos Santos Silvério (IFSP), Luciana Brasil Rebelo dos Santos (IFSP)
ST14 – MEDIA CONTENT ANALYSIS 14:00	Alan Guedes (PUC-Rio)	Incorporating context information in session based recommenders	Gabriel Baltazar (USP), Igor Lovatto (USP), Matheus Takata (USP) e Marcelo Manzato(USP)
ST14 – MEDIA CONTENT ANALYSIS 14:00	Alan Guedes (PUC-Rio)	Online tool to assist volunteer firefighters in Santa Catarina State	Igor Benedet (IFC), Daniel de Andrade Varela (IFC), Rodrigo Ramos Nogueira (IFC)
ST14 – MEDIA CONTENT ANALYSIS 14:00	Alan Guedes (PUC-Rio)	? UnderApp: A System For Remote Monitoring Of Landslides Based On Wireless Underground Sensor Networks	Creyton Ferreira (CEFET/RJ), Viviane Peixoto (CEFET/RJ), Jorge Brito (CEFET/RJ), AndreFelipe Monteiro (CEFET/RJ), Laura Assis (CEFET/RJ), Felipe Henriques (CEFET/RJ)
ST14 – MEDIA CONTENT ANALYSIS 14:00	Alan Guedes (PUC-Rio)	? Using Deep Learning to Recognize People by Face and Voice	Lucas da Silva (PUC-Rio), Alan Guedes (Puc-Rio), Sérgio Colcher (PUC-Rio)
ST14 – MEDIA CONTENT ANALYSIS 14:00	Alan Guedes (PUC-Rio)	A Context-Aware Platform For Personalized Content Delivery In Educational Environments	Andre Felipe Monteiro (CEFET/RJ), Victória Rodrigues (CEFET/RJ), Raquel Barreto(CEFET/RJ)
ST14 – MEDIA CONTENT ANALYSIS 14:00	Alan Guedes (PUC-Rio)	? A Social Network Analysis of Football with Complex Networks	Lucas Felix (UFSJ), Carolina Xavier (UFSJ), Carlos Barbosa (UFSJ), Vinícius Vieira (UFSJ)
ST14 – MEDIA CONTENT ANALYSIS 14:00	Alan Guedes (PUC-Rio)	Application of Machine Learning Techniques in Human Activity Recognition using Wearable and Mobile Devices	Bruno Henrique Rasteiro (USP), Flavio Santana (USP)
ST14 – MEDIA CONTENT ANALYSIS 14:00	Alan Guedes (PUC-Rio)	BumbAR: Multimedia Authoring Through Augmented Reality	Paulo Renato Conceição Mendes (UFMA), Carlos Soares Neto (UFMA)
ST14 – MEDIA CONTENT ANALYSIS 14:00	Alan Guedes (PUC-Rio)	? Sara – A Semi-Automatic Framework for Social Network Analysis	Carlos Barbosa (UFSJ), Lucas Felix (UFSJ), Vinícius Vieira (UFSJ), Carolina Xavier (UFSJ)
ST14 – MEDIA CONTENT ANALYSIS 14:00	Alan Guedes (PUC-Rio)	A Mobile Application for motor coordination deficiency users	Roseli Ap. Francelin Romero (USP), Tiago Leite (USP)
ST14 – MEDIA CONTENT ANALYSIS 14:00	Alan Guedes (PUC-Rio)	Using IoT technologies to develop a low-cost smart medicine box	Danyllo Valente da Silva (UFRJ), Taisa Guidini Gonçalves (UFRJ), Paulo F. Pires (UFRJ)
ST14 – MEDIA CONTENT ANALYSIS 14:00	Alan Guedes (PUC-Rio)	PipaBot: um canal de comunicação para o PIPA UFRJ	Lucas de Paula (UFRJ), Taisa Guidini Gonçalves (UFRJ), Thatiana Fernandes (UFRJ),Guilherme Horta Travassos (UFRJ)
ST14 – MEDIA CONTENT ANALYSIS 14:00	Alan Guedes (PUC-Rio)	Bentham Obras: Um Sistema de Gestão Inteligente para a Construção Civil	Iesus Batista (IFCE), Alice Feitosa (IFCE), Luan Douglas (IFCE), Renato Oliveira (IFCE),Matheus Gurgel (IFCE), Arthur Bezerra (IFCE), Carina Oliveira (IFCE), Reinaldo Braga
ST14 – MEDIA CONTENT ANALYSIS 14:00	Alan Guedes (PUC-Rio)	Linked Data Application for publishing and retrieving data from mammalian collections	Helder Monteiro Cosme (UFRJ), Adriana Pereira de Medeiros (UFF)
ST14 – MEDIA CONTENT ANALYSIS 14:00	Alan Guedes (PUC-Rio)	PVBR-Recog: Uma Ferramenta para Detecção e Reconhecimento de Placas Veiculares Brasileiras	Pedro Ferreira Alves Pinto (PUC-Rio), Antonio José Grandson Busson (PUC-Rio), SérgioColcher (PUC-Rio), Ruy Luiz Milidiú (PUC-Rio)
